{
  "version": 1,
  "kind": "hypothesis-registry",
  "authority": "none",
  "observed_on": "2026-08-15",
  "expires": "2026-11-13",
  "source_scope": "Concept-only observations from one private venture. No source wording, path, ruling, commercial detail or reusable asset was imported.",
  "source_fingerprint": "0d21d7ea0e52900e24d747e2f87bce06b00ecb46d3fdb2c9e899450244b89c29",
  "promotion_rule": "A candidate remains non-authoritative until a second independent venture encounters the same fork, independent research supports admission, and the EOS content gate accepts a new Doctrine or Wargame.",
  "expiry_action": "archive-or-refresh",
  "rows": [
    {"id": "HYP-CREATIVE-001", "domain": "visual direction", "question": "Should visual direction stay consistent across surfaces or vary by audience and task?", "status": "candidate", "observed_ventures": 1, "required_ventures": 2, "admission_state": "unresearched"},
    {"id": "HYP-CREATIVE-002", "domain": "visual direction", "question": "Should colour variants be authored into each asset or derived through a controlled palette transformation?", "status": "candidate", "observed_ventures": 1, "required_ventures": 2, "admission_state": "unresearched"},
    {"id": "HYP-CREATIVE-003", "domain": "visual direction", "question": "Which independent cues should communicate rarity without relying on colour alone?", "status": "candidate", "observed_ventures": 1, "required_ventures": 2, "admission_state": "unresearched"},
    {"id": "HYP-CREATIVE-004", "domain": "visual direction", "question": "How tightly should references be versioned and constrained during creative production?", "status": "candidate", "observed_ventures": 1, "required_ventures": 2, "admission_state": "unresearched"},
    {"id": "HYP-CREATIVE-005", "domain": "visual direction", "question": "Should excluded visual treatments be enforced by guidance, review or a machine gate?", "status": "candidate", "observed_ventures": 1, "required_ventures": 2, "admission_state": "unresearched"},
    {"id": "HYP-CREATIVE-006", "domain": "asset generation", "question": "Which production route is sufficient for each asset class?", "status": "candidate", "observed_ventures": 1, "required_ventures": 2, "admission_state": "unresearched"},
    {"id": "HYP-CREATIVE-007", "domain": "asset generation", "question": "What combination of review, reference control and gates proves generated assets are consistent enough?", "status": "candidate", "observed_ventures": 1, "required_ventures": 2, "admission_state": "unresearched"},
    {"id": "HYP-CREATIVE-008", "domain": "asset generation", "question": "How much provenance and disclosure must travel with generated creative material?", "status": "candidate", "observed_ventures": 1, "required_ventures": 2, "admission_state": "unresearched"},
    {"id": "HYP-CREATIVE-009", "domain": "asset generation", "question": "Where should user-generated creative work run and where should moderation sit?", "status": "candidate", "observed_ventures": 1, "required_ventures": 2, "admission_state": "unresearched"},
    {"id": "HYP-CREATIVE-010", "domain": "asset generation", "question": "Which creative-generation steps need a recorded human checkpoint?", "status": "candidate", "observed_ventures": 1, "required_ventures": 2, "admission_state": "unresearched"},
    {"id": "HYP-CREATIVE-011", "domain": "asset generation", "question": "Should generation inputs be free-form or versioned as a reproducible input pack?", "status": "candidate", "observed_ventures": 1, "required_ventures": 2, "admission_state": "unresearched"},
    {"id": "HYP-CREATIVE-012", "domain": "animation", "question": "Should motion be authored per finished asset or composed from reusable elements and cues?", "status": "candidate", "observed_ventures": 1, "required_ventures": 2, "admission_state": "unresearched"},
    {"id": "HYP-CREATIVE-013", "domain": "animation", "question": "Which motion stays live at runtime and which is safely rendered into a composite?", "status": "candidate", "observed_ventures": 1, "required_ventures": 2, "admission_state": "unresearched"},
    {"id": "HYP-CREATIVE-014", "domain": "animation", "question": "What motion budget keeps a surface legible, accessible and alive on target devices?", "status": "candidate", "observed_ventures": 1, "required_ventures": 2, "admission_state": "unresearched"},
    {"id": "HYP-CREATIVE-015", "domain": "animation", "question": "How far should presentation cues be separated from the underlying state model?", "status": "candidate", "observed_ventures": 1, "required_ventures": 2, "admission_state": "unresearched"},
    {"id": "HYP-CREATIVE-016", "domain": "animation", "question": "Should a short visual effect be produced procedurally or rendered as an asset?", "status": "candidate", "observed_ventures": 1, "required_ventures": 2, "admission_state": "unresearched"},
    {"id": "HYP-CREATIVE-017", "domain": "audio", "question": "Should sound effects be selected by action, material, element or another stable semantic key?", "status": "candidate", "observed_ventures": 1, "required_ventures": 2, "admission_state": "unresearched"},
    {"id": "HYP-CREATIVE-018", "domain": "audio", "question": "Which source, licence and disclosure route is appropriate for each audio class?", "status": "candidate", "observed_ventures": 1, "required_ventures": 2, "admission_state": "unresearched"},
    {"id": "HYP-CREATIVE-019", "domain": "audio", "question": "Does the product need adaptive music, a bounded cue set or ambient sound only?", "status": "candidate", "observed_ventures": 1, "required_ventures": 2, "admission_state": "unresearched"},
    {"id": "HYP-CREATIVE-020", "domain": "balance", "question": "Should balance be tuned by judgement, declared invariants, simulation or a measured combination?", "status": "candidate", "observed_ventures": 1, "required_ventures": 2, "admission_state": "unresearched"},
    {"id": "HYP-CREATIVE-021", "domain": "balance", "question": "What evidence proves a balance change is safe enough to release?", "status": "candidate", "observed_ventures": 1, "required_ventures": 2, "admission_state": "unresearched"},
    {"id": "HYP-CREATIVE-022", "domain": "balance", "question": "How should scarcity, utility and power remain distinguishable?", "status": "candidate", "observed_ventures": 1, "required_ventures": 2, "admission_state": "unresearched"},
    {"id": "HYP-CREATIVE-023", "domain": "balance", "question": "Which tunable values belong in data and which must remain enforced by code?", "status": "candidate", "observed_ventures": 1, "required_ventures": 2, "admission_state": "unresearched"},
    {"id": "HYP-CREATIVE-024", "domain": "procedural generation", "question": "Should variation be generated at runtime or selected from a pre-generated corpus?", "status": "candidate", "observed_ventures": 1, "required_ventures": 2, "admission_state": "unresearched"},
    {"id": "HYP-CREATIVE-025", "domain": "procedural generation", "question": "What seed, replay and re-resolution discipline makes generated shared state reproducible?", "status": "candidate", "observed_ventures": 1, "required_ventures": 2, "admission_state": "unresearched"},
    {"id": "HYP-CREATIVE-026", "domain": "procedural generation", "question": "Should authors define reusable atoms or pre-approve the combinations produced from them?", "status": "candidate", "observed_ventures": 1, "required_ventures": 2, "admission_state": "unresearched"},
    {"id": "HYP-CREATIVE-027", "domain": "creative lifecycle", "question": "Which review gates must a creative artefact pass before release?", "status": "candidate", "observed_ventures": 1, "required_ventures": 2, "admission_state": "unresearched"},
    {"id": "HYP-CREATIVE-028", "domain": "creative lifecycle", "question": "Should production ceremony vary by reversibility, exposure and asset risk?", "status": "candidate", "observed_ventures": 1, "required_ventures": 2, "admission_state": "unresearched"},
    {"id": "HYP-CREATIVE-029", "domain": "creative lifecycle", "question": "Which durable record should track a creative asset through production and release?", "status": "candidate", "observed_ventures": 1, "required_ventures": 2, "admission_state": "unresearched"},
    {"id": "HYP-CREATIVE-030", "domain": "creative lifecycle", "question": "Which source artefacts need enduring records and which derived outputs may be regenerated?", "status": "candidate", "observed_ventures": 1, "required_ventures": 2, "admission_state": "unresearched"}
  ]
}
